{
  "mode": "debrief",
  "trace_id": "db_01HXYZ9999",
  "action_taken": "waited",
  "outcome_reported": "They reached out the next day and the tone was calmer.",
  "matched_prediction": "yes",
  "validation": "Yep. When you stopped chasing, it gave the situation space to soften. Stillness did more than a paragraph ever would.",
  "outcome_tag": "Successful De-escalation",
  "lesson_learned": "When you feel the urge to push, pausing is often the power move.",
  "next_step": "If you reply, keep it short and warm. One message, no follow-ups.",
  "save_opt_in": true
}


